{
  "capabilities": [
    {
      "id": "product-layout",
      "label": "Product layout implementation",
      "notes": "Each product owns layout decisions while consuming approved identity constraints and bounded overrides.",
      "owner": "consumer",
      "status": "not-declared"
    },
    {
      "id": "reusable-components",
      "label": "Reusable application components",
      "notes": "Identity records component-facing constraints but does not define or distribute component implementations.",
      "owner": "holon",
      "status": "not-declared"
    },
    {
      "id": "semantic-tokens",
      "label": "Semantic token guidance",
      "notes": "Identity owns the reviewed DTCG token source, inheritance evidence, and generated platform projections.",
      "owner": "identity",
      "status": "declared"
    }
  ],
  "inheritance": {
    "organizationLayers": [
      "example-organization"
    ],
    "overrides": [
      {
        "approval": "approve-product-primary",
        "reason": "Give the product a distinct violet technical accent.",
        "token": "color.brand.primary"
      }
    ],
    "productLayer": "example-product"
  },
  "profiles": [
    {
      "id": "core",
      "version": "1.0.0"
    },
    {
      "id": "metadata",
      "version": "1.0.0"
    },
    {
      "id": "tokens",
      "version": "1.0.0"
    }
  ],
  "project": {
    "displayName": "Example Product",
    "id": "example-product",
    "kind": "product",
    "repository": "https://example.invalid/example-product"
  },
  "references": [
    {
      "affectsCanonical": false,
      "capturedAt": "2026-08-22T10:05:00Z",
      "decision": "adapt",
      "id": "greptile-design",
      "notes": "Study the information architecture only. Identity keeps its source, renderer, accessibility, and provenance contracts independent.",
      "patterns": [
        "Concise public guidance that combines visual assets, typography, color, and usage context.",
        "Clear presentation of downloadable approved assets without making a website the source of truth."
      ],
      "rights": "Do not copy, download, redistribute, or imply permission to use Greptile trademarks, assets, or proprietary copy.",
      "url": "https://www.greptile.com/design"
    }
  ],
  "schema": "identity.design-system-handbook/v1",
  "sections": [
    {
      "entries": [],
      "id": "experience",
      "principles": [
        {
          "appliesTo": [
            "product",
            "repository"
          ],
          "guidance": "Pair visual distinction, motion, and mascot expression with readable content and supported accessibility alternatives.",
          "id": "meaning-survives-style",
          "rationale": "A recognizable system remains useful when motion is reduced, colors vary, or imagery is unavailable.",
          "title": "Make meaning survive styling changes"
        }
      ],
      "summary": "Brand character reinforces meaning without becoming the only way users can understand or operate a surface.",
      "title": "Accessible expression"
    },
    {
      "entries": [],
      "id": "foundations",
      "principles": [
        {
          "appliesTo": [
            "organization",
            "product",
            "repository"
          ],
          "guidance": "Choose tokens by the role they serve before choosing a visual treatment.",
          "id": "semantic-before-decorative",
          "rationale": "Semantic intent keeps product overrides reviewable and preserves accessibility across themes.",
          "title": "Start with semantic intent"
        }
      ],
      "summary": "Use semantic tokens and reviewed guidance as the shared starting point for every product surface.",
      "title": "Reviewed foundations"
    },
    {
      "entries": [
        {
          "content": {
            "governance": {
              "approval": "approve-usage-core",
              "provenance": {
                "capturedAt": "2026-08-21T12:15:00Z",
                "method": "human-authored",
                "source": ".identity/brief.md"
              },
              "state": "approved",
              "subject": "usage:core-guidance",
              "visibility": "public"
            },
            "rules": [
              "Use reviewed contrast pairings",
              "Provide contextual alternative text",
              "Honor reduced motion",
              "Never encode state by color alone"
            ],
            "summary": "Identity expression must preserve perceivable content, readable text, operable controls, and understandable status without relying on brand styling alone."
          },
          "id": "accessibility",
          "kind": "accessibility",
          "rationale": "Identity expression must preserve perceivable content, readable text, operable controls, and understandable status without relying on brand styling alone.",
          "sourceLayer": null,
          "status": "declared"
        },
        {
          "content": {
            "availability": "public",
            "downloadName": "example-product-mark.svg",
            "governance": {
              "approval": "approve-primary-mark",
              "provenance": {
                "capturedAt": "2026-08-21T12:00:00Z",
                "method": "human-authored",
                "source": ".identity/governance/provenance.json#mark"
              },
              "state": "approved",
              "subject": "mark",
              "visibility": "public"
            },
            "id": "mark",
            "kind": "mark",
            "label": "Primary mark",
            "notes": "Approved for current product, documentation, and repository use.",
            "path": ".identity/sources/mark.svg",
            "replacement": null,
            "status": "active"
          },
          "id": "asset:mark",
          "kind": "asset",
          "rationale": "Approved for current product, documentation, and repository use.",
          "sourceLayer": null,
          "status": "declared"
        },
        {
          "content": {
            "attribution": "Preserve attribution from the governed provenance record when distributing an asset.",
            "copyright": "Copyright 2026 Example. Source assets retain their recorded copyright and license terms.",
            "governance": {
              "approval": "approve-usage-core",
              "provenance": {
                "capturedAt": "2026-08-21T12:15:00Z",
                "method": "human-authored",
                "source": ".identity/governance/provenance.json"
              },
              "state": "approved",
              "subject": "usage:core-guidance",
              "visibility": "public"
            },
            "thirdPartyLicenses": [
              {
                "attribution": "Copyright 2026 Example",
                "name": "Example Product fixture assets",
                "spdx": "MIT"
              }
            ],
            "trademark": "Example Product names and marks may be used only to identify the project without implying endorsement."
          },
          "id": "legal",
          "kind": "legal",
          "rationale": "Preserve attribution from the governed provenance record when distributing an asset.",
          "sourceLayer": null,
          "status": "declared"
        },
        {
          "content": {
            "id": "core",
            "version": "1.0.0"
          },
          "id": "profile:core",
          "kind": "profile",
          "rationale": "Enabled versioned output profile selected by the reviewed project source.",
          "sourceLayer": null,
          "status": "declared"
        },
        {
          "content": {
            "id": "metadata",
            "version": "1.0.0"
          },
          "id": "profile:metadata",
          "kind": "profile",
          "rationale": "Enabled versioned output profile selected by the reviewed project source.",
          "sourceLayer": null,
          "status": "declared"
        },
        {
          "content": {
            "id": "tokens",
            "version": "1.0.0"
          },
          "id": "profile:tokens",
          "kind": "profile",
          "rationale": "Enabled versioned output profile selected by the reviewed project source.",
          "sourceLayer": null,
          "status": "declared"
        },
        {
          "content": {
            "approval": null,
            "constraints": {},
            "overrideReason": null,
            "path": "color.action.primary",
            "sourceLayer": "example-product",
            "type": "color",
            "value": {
              "alpha": 1,
              "colorSpace": "srgb",
              "components": [
                0.42,
                0.2,
                0.72
              ]
            }
          },
          "id": "token:color.action.primary",
          "kind": "token",
          "rationale": "Resolved from the reviewed semantic token source.",
          "sourceLayer": "example-product",
          "status": "declared"
        },
        {
          "content": {
            "approval": "approve-product-primary",
            "constraints": {
              "contrast": {
                "intent": "decorative",
                "minimumRatio": 1,
                "pairedWith": []
              },
              "override": {
                "approval": "approve-product-primary",
                "reason": "Give the product a distinct violet technical accent."
              }
            },
            "overrideReason": "Give the product a distinct violet technical accent.",
            "path": "color.brand.primary",
            "sourceLayer": "example-product",
            "type": "color",
            "value": {
              "alpha": 1,
              "colorSpace": "srgb",
              "components": [
                0.42,
                0.2,
                0.72
              ]
            }
          },
          "id": "token:color.brand.primary",